{"$id":"learnit://human-control-plane/learning-registry/v1","$schema":"https://json-schema.org/draft/2020-12/schema","additionalProperties":false,"properties":{"applicability_model":{"type":"object"},"coverage":{"type":"object"},"learnings":{"items":{"additionalProperties":false,"properties":{"applicability":{"enum":["APPLICABLE","NOT_APPLICABLE","STALE","INVALID","UNKNOWN"],"type":"string"},"applies_when":{"type":["array","object","string"]},"confidence":{"enum":["HIGH","MODERATE","LOW","UNKNOWN"],"type":"string"},"date_captured":{"type":"string"},"does_not_apply_when":{"type":["array","object","string"]},"freshness_class":{"enum":["STATIC","SLOW_CHANGING","PROJECT_BOUND","ENVIRONMENT_BOUND","TIME_SENSITIVE","EPHEMERAL"],"type":"string"},"invalidate_if":{"type":["array","object","string"]},"learning_id":{"minLength":1,"type":"string"},"persistence":{"enum":["ARTIFACT_LEARNING"],"type":"string"},"provenance":{"type":["array","object"]},"reuse_targets":{"items":{"type":"string"},"type":"array"},"review_after":{"type":["string","null"]},"scope":{"enum":["TURN","CONVERSATION","PROJECT","WORKFLOW","DOMAIN","USER_PREFERENCE","GLOBAL_PROCESS_RULE"],"type":"string"},"sensitivity":{"type":"string"},"source_event":{"type":["string","object"]},"source_evidence":{"items":{"type":["string","object"]},"minItems":1,"type":"array"},"state_identity":{"minLength":1,"type":"string"},"statement":{"minLength":1,"type":"string"},"status":{"enum":["CANDIDATE","VALIDATED","DEPRECATED","INVALIDATED","FORGOTTEN"],"type":"string"},"type":{"minLength":1,"type":"string"},"valid_until":{"type":["string","null"]}},"required":["learning_id","statement","type","source_event","source_evidence","date_captured","scope","applies_when","does_not_apply_when","confidence","freshness_class","invalidate_if","provenance","reuse_targets","sensitivity","persistence","status","applicability","state_identity"],"type":"object"},"type":"array"},"lifecycle_policy":{"type":"object"},"registry_identity":{"pattern":"^sha256-canonical-payload:[0-9a-f]{64}$","type":"string"},"schema":{"const":"governed-learning-registry.v1"},"semantic_authority":{"additionalProperties":false,"properties":{"kernel":{"const":"UAL"},"state_identity":{"const":"sha256:06b59a480f69f16719498b29c56185392549729a7fae59f7fed33d5b42ec4db2"},"version":{"const":"1.0"}},"required":["kernel","version","state_identity"],"type":"object"},"source_of_truth":{"additionalProperties":false,"properties":{"canonical_file":{"const":"LEARNING_REGISTRY.json"},"type":{"const":"CHATGPT_LIBRARY_ARTIFACT"}},"required":["type","canonical_file"],"type":"object"},"state_role":{"const":"STATE_NOT_AUTHORITY"},"update_contract":{"type":"object"},"updated_at":{"type":"string"}},"required":["schema","registry_identity","updated_at","semantic_authority","state_role","source_of_truth","update_contract","coverage","lifecycle_policy","applicability_model","learnings"],"title":"Governed Learning Registry","type":"object"}
